Category,Supporting Ministry,Community,Project,Status,Target Completion Date,Description,Result,Area,Region,Address,Postal Code,Highway / Transit Line,Estimated Total Budget,Municipal Funding,Provincial Funding,Federal Funding,Other Funding,Website,Latitude,Longitude,Geometry
Communities,Infrastructure,NORTH FRONTENAC,Renovation and Addition of an Accessible Washroom at the Snow Road Community Hall,Planning,2021,The Snow Road Community Hall renovations will involve constructing an accessible addition to the existing washrooms at the community hall.,,FRONTENAC,East,6648 Road 506 Road,K0H2M0,,"$60,555 ",Yes,Yes,Yes,Yes,https://www.news.ontario.ca/en/release/1000261/canada-and-ontario-invest-to-improve-recreational-facilities-in-the-county-of-frontenac,44.94099,-76.95301,
Communities,"Tourism, Culture and Sport",NORTH FRONTENAC,North Frontenac Tp,Under construction,23-Feb,"Our Municipality, with a $122,200 Community Building Fund – Capital stream grant over 12 months, will address a community need by resurfacing two tennis/pickleball courts and purchasing new equipment to improve the safety and longevity of these facilities for community members. ",,FRONTENAC,East,14453 Highway 41,K0H 1K0,,"$122,200 ",,Yes,,,,44.828157,-77.185602,
Recreation,Infrastructure,NORTH GLENGARRY,Refurbishment of the Glengarry Sports Palace – CCRIS,Planning,2022,"The refurbishment of the Glengarry Sports Palace includes the replacement of a concrete arena slab, rink boards and glass, windows and doors, lighting and a boiler while the spectator seating area and ventilation, plumbing, and electrical systems will also be improved. Other updates involve fire safety upgrades and the addition of a gender inclusive bathroom and players’ rooms. The refurbishment will create a safer and more accessible place for players and spectators and provide residents with a modern sports centre where residents can stay fit and healthy for years to come.",,"STORMONT, DUNDAS AND GLENGARRY",East,90 Main Street/Rue South/Sud,K0C1A0,,"$2,158,875 ",Yes,Yes,Yes,,https://www.news.ontario.ca/en/release/1000034/canada-and-ontario-invest-over-44-m-in-improved-culture-recreation-and-green-infrastructure-in-partnership-with-15-communities-across-ontario,45.312806,-74.644867,
Recreation,"Tourism, Culture and Sport",NORTH GLENGARRY,North Glengarry Tp,Under construction,23-Feb,"Our Municipality, with a $490,600 Community Building Fund – Capital stream grant over 12 months, will address a community need by installing a heating, ventilation and air conditioning unit to the arena area, creating a year-round venue for sports and recreation. ",,"STORMONT, DUNDAS AND GLENGARRY",East,25 Fair Street,K0C 1A0,,"$490,600 ",,Yes,,,,45.292279,-74.853303,
Roads and bridges,Transportation,NORTH GLENGARRY,Hwy 417 resurfacing ,Under construction,2019,Resurfacing on 13.2 km from County Rd. 23 to Dalkeith Rd. Interchange improvements at Hwy 417/Hwy 34 and a culvert rehabilitation.,,"STORMONT, DUNDAS AND GLENGARRY",East,,,,"$20,349,000 ",,Yes,,,,45.467624,-74.680063,
Child care,Education,NORTH GRENVILLE,Kemptville Public Elementary School,Under construction,2022,Expansion of existing school,Addition to accommodate 49 child care spaces and 2 EarlyON rooms,LEEDS AND GRENVILLE,East,224 LEEDS AND GRENVILLE 44 RD,K0G 1J0,,"$3,262,558 ",,Yes,,,,45.0213155,-75.6519408,
Education,Education,NORTH GRENVILLE,école élémentaire et secondaire catholique Notre-Dame,Planning,26-Sep,Construction of new school,"New facility to accommodate 417 underserved French-language students, including the construction of 39 child care spaces",LEEDS AND GRENVILLE,East,TBD,K0G 1JO,,"$14,915,375 ",,Yes,,,,,,
Roads and bridges,Infrastructure,NORTH GRENVILLE,Expansion and upgrade of County Road 43 and Rehabilitation of Bridge across Kemptville Creek,Planning,24-Nov,"The upgrade and expansion of County Road 43 will see, among other aspects, the widening of roadways, more crosswalks, new bike lanes and street lighting. These upgrades will improve the safety and reliability of the roads for pedestrians, cyclists and motorists. The project will also rehabilitate the 39-metre bridge which crosses Kemptville Creek.",,LEEDS AND GRENVILLE,East,25 Central Avenue West,K6V4N6,,"$8,332,937 ",Yes,Yes,Yes,,,45.02437,-75.647366,
Broadband,Infrastructure,NORTH HURON,Wingham - East UBF Project,Planning,25-Dec,New broadband construction by Huron Communications,Providing reliable internet access,HURON,Southwest,,,,"$742,700 ",,Yes,Yes,Yes,,43.8986379,-81.2739421,
Communities,Infrastructure,NORTH HURON,Wingham Standpipe Replacement,Planning,23-May,Replacement of the Wingham Standpipe. The work aims to increase water pressure in low pressure areas within the distribution system.,,HURON,Southwest,274 Josephine Street/Rue,N0G2W0,,"$2,852,040 ",Yes,Yes,Yes,,https://www.news.ontario.ca/en/release/1000459/canada-and-ontario-invest-over-29-million-in-19-green-infrastructure-projects,43.883634,-81.306086,
Recreation,Infrastructure,NORTH HURON,Rehabilitation of the North Huron Wescast Community Complex (NHWCC),Planning,23-Dec,"The project will replace the pool dehumidifier, lower roof, and insulation in interior walls, and remove barriers to showers in the changerooms and dressing rooms. In addition, the sound system will be replaced while baffling in the hall, basketball hoops, and an indoor walking surface will be installed. The upgrades will improve accessibility and use of the facility while increasing energy efficiency and managing humidity levels.",,HURON,Southwest,274 Josephine Street/Rue,N0G2W0,,"$839,475 ",Yes,Yes,Yes,,https://www.news.ontario.ca/en/release/61048/30-bundle-en,43.88043,-81.31367,
Recreation,"Tourism, Culture and Sport",NORTH KAWARTHA,North Kawartha Tp,Under construction,23-May,"Our Municipality, with a $156,700 Community Building Fund – Capital stream grant over 12 months, will address a community need by creating accessible parking, entrances, washrooms and kitchen making the Glen Alda Community Centre fully accessible and extending the life of the facility. ",,PETERBOROUGH,East,3723 County Road 620,K0L 1A0,,"$156,700 ",,Yes,,,,44.841933,-77.939852,
Education,Education,NORTH PERTH,Listowel Eastdale Public Elementary School,Planning,23-Sep,Expansion of existing school,"New classroom addition of 98 pupil places for a growing school, including 49 child care spaces",PERTH,Southwest,365 NICHOL AVE S,N4W 2M3,,"$4,263,961 ",,Yes,,,,43.72679,-80.94957,
Child care,Education,NORTHEASTERN MANITOULIN AND THE ISLANDS,Little Current Public Elementary School,Planning,2022,Renovation of existing school,Renovation to accommodate 10 child care spaces,MANITOULIN,Northeast,18 DRAPER ST,P0P 1K0,,"$327,711 ",,Yes,,,,45.97631,-81.9268,
Child care,Education,NORTHERN BRUCE PENINSULA,St. Edmunds Public Elementary School,Planning,2022,Renovation of existing school,Renovation to accommodate 39 child care spaces,BRUCE,Southwest,21 CENTENNIAL DR,N0H 2R0,,"$561,565 ",,Yes,,,,45.24456,-81.65063,
Recreation,Infrastructure,NORTHERN BRUCE PENINSULA,Improvement to Lion's Head Community Centre and Arena,Planning,23-Mar,"The project will expand and rehabilitate the community centre and arena by adding six, barrier-free dressing rooms, a multi-purpose room, new library space, and by rehabilitating and adding new  washrooms to address accessibility. The changes will improve community access and functionality, and encourage healthy lifestyles.  ",,BRUCE,Southwest,56 Lindsay Road,N0H1W0,,"$4,939,546 ",Yes,Yes,Yes,,https://www.news.ontario.ca/en/release/61048/30-bundle-en,44.58553,-81.15127,
Broadband,Infrastructure,NORTHUMBERLAND COUNTY,Eastern Ontario Regional Network (EORN) Cellular Gap Project,Under construction,25-Aug,"Description: A regional project adding new cellular infrastructure to increase network coverage and capacity across eastern Ontario. Note that the funding listed below is for the entire project, not just this municipality. ","Expanding reliable cellular services which are essential to support economic development, improve public safety and connect with others",NORTHUMBERLAND,East,,,,"$300,000,000 ",Yes,Yes,Yes,Yes,https://www.eorn.ca/en/projects/improving-cell-service.aspx,44.092295,-77.938719,
Communities,Infrastructure,NORTHWEST ANGLE #33 FIRST NATION,Dogpaw Water Treatment Plant Upgrades Project,Planning,22-Dec,"These investments will ensure access to safe, drinkable water and better environmental protection for First Nation communities across Ontario.",,,Northwest,General Delivery-Box 1490,P9N3X7,,"$2,784,249 ",Yes,Yes,Yes,,,49.234799,-93.564301,
Recreation,Infrastructure,NORWICH,Roof Replacement Norwich Community Centre/Arena,Planning,2021,Replacement of the existing steel roof of the Norwich community centre and arena. This will include the stripping and disposal of the current steel roof structure and the construction and installation of a new standing seam steel roof finished with a combination steel and single ply membrane.,,OXFORD,Southwest,285767 Airport Road,N0J1P0,,"$660,000 ",Yes,Yes,Yes,,https://www.news.ontario.ca/en/release/1000470/canada-and-ontario-invest-over-35-million-in-35-recreational-and-community-infrastructure-projects,42.98679,-80.602925,
Child care,Education,OAKVILLE,École élémentaire publique Patricia-Picknell,Planning,2021,Renovation of existing school,Renovation to accommodate 24 child care spaces,HALTON,Central,1257 SEDGEWICK CRES,L6L 1X5,,"$257,127 ",,Yes,,,,43.41587,-79.69682,
Education,Education,OAKVILLE,école secondaire catholique Sainte-Trinité,Under construction,2022,Expansion of existing school,New classroom addition of 180 pupil places for a growing school,HALTON,Central,2600 GRAND OAK TRAIL,L6M 0R4,,"$6,590,481 ",,Yes,,Yes,,43.43723822,-79.77364943,
Education,Education,OAKVILLE,Oakville NE 1 Public Secondary School,Planning,25-Sep,Construction of new school,"New facility to accommodate 1200 students in a growing community, including the construction of 88 child care spaces",HALTON,Central,1013 DUNDAS ST W,L6M 4L8,,"$36,531,262 ",,Yes,,,,43.46488301,-79.74606722,
Education,Education,OAKVILLE,North Oakville 4 Catholic Elementary School,Planning,23-Jan,Construction of new school,New facility to accommodate 671 students in a growing community,HALTON,Central,THRESHING MILL BLVD / POSTRIDGE DR,TBD,,"$14,499,502 ",,Yes,,,,,,
Education,Education,OAKVILLE,Oakville NE 3 Public Elementary School,Planning,23-Sep,Construction of new school,"New facility to accommodate 788 students in a growing community, including the construction of 88 child care spaces",HALTON,Central,DUNDAS ST E / PRINCE MICHAEL DR,,,"$20,759,973 ",,Yes,,,,43.49821246,-79.70882834,
Education,Education,OAKVILLE,Oakville NE 5 Public Elementary School,Planning,26-Sep,Construction of new school,"New facility to accommodate 788 students in a growing community, including the construction of 88 child care spaces",HALTON,Central,TBD,L6H 7C8,,"$23,873,969 ",,Yes,,,,,,
Transit,Transportation,OAKVILLE,Lakeshore West Corridor Expansion - Burloak Drive Grade Separation,Planning,To Be Determined,GO Expansion - Early Works,Metrolinx is working with the City of Burlington and the Town of Oakville to build the Burloak Drive underpass which will improve traffic flow without having to wait for trains to pass.,HALTON,Central,,,,0,,,,,https://www.metrolinx.com/en/greaterregion/projects/burloak-drive-underpass.aspx,43.39035135,-79.74974574,
Transit,Transportation,OAKVILLE,Conventional Vehicle Replacement - 2022,Planning,23-Mar,Purchase 8 zero-emission buses to replace ageing ones along with 8 heavy-duty charging stations.,"Reduced operation and maintenance costs, and quieter bus operations.",HALTON,Central,,,,"$9,060,000 ",Yes,Yes,Yes,,,,,
Transit,Transportation,OAKVILLE,Real-Time Scheduling System and Digital Screens,Planning,2022,"Introduce on-demand scheduling and real-time trip management technology, and install bus arrival display screens in high-traffic areas.",Increased quality and convenience of the public transit system,HALTON,Central,,,,"$510,000 ",Yes,Yes,Yes,,,,,
Transit,Transportation,OAKVILLE,Bus Stop Accessibility Improvements,Under construction,2022,"Improvements to landing pads, walkways, ramps, and curbs at approximately 249 bus stops in the city’s public transit system. ","Improved quality, safety, and accessibility of the public transit system for all users.",HALTON,Central,,,,"$500,000 ",Yes,Yes,Yes,,,,,
Transit,Transportation,OAKVILLE,Specialized Vehicle Replacement,Planning,26-Dec,"Purchase 18 specialized zero-emission battery-electric buses, and install 10 light-duty electric bus charging stations.",Reduced operation and maintenance costs.,HALTON,Central,,,,"$8,650,000 ",Yes,Yes,Yes,,,,,
Transit,Transportation,OAKVILLE,Specialized Vehicle Expansion,Planning,26-Dec,Purchase nine additional specialized zero-emission battery-electric buses.,"Improved quality and capacity of the public transit system, while reducing the fleet’s carbon emissions.",HALTON,Central,,,,"$4,590,000 ",Yes,Yes,Yes,,,,,
Transit,Transportation,OAKVILLE,Conventional Vehicle Expansion,Planning,23-Mar,Purchase seven zero-emission battery-electric buses and seven charging stations.,"Improved quality and capacity of the public transit system, while reducing the fleet’s carbon emissions.",HALTON,Central,,,,"$8,278,810 ",Yes,Yes,Yes,,,,,
Transit,Transportation,OAKVILLE,Conventional Vehicle Replacement,Planning,27-Mar,Purchase two zero emission battery-electric buses.,"Improved quality and capacity of the public transit system, while reducing the fleet’s carbon emissions.",HALTON,Central,,,,"$2,040,000 ",Yes,Yes,Yes,,,,,
Transit,Transportation,OAKVILLE,Conventional Vehicle Replacement,Planning,26-Mar,Purchase eight zero emission battery-electric buses.,"Improved quality and capacity of the public transit system, while reducing the fleet’s carbon emissions.",HALTON,Central,,,,"$8,160,000 ",Yes,Yes,Yes,,,,,
Transit,Transportation,OAKVILLE,Conventional Vehicle Replacement,Planning,25-Mar,Purchase six zero emission battery-electric buses.,"Improved quality and capacity of the public transit system, while reducing the fleet’s carbon emissions.",HALTON,Central,,,,"$6,120,000 ",Yes,Yes,Yes,,,,,
Transit,Transportation,OAKVILLE,Conventional Vehicle Replacement ,Planning,24-Mar,Purchase eight zero emission battery-electric buses.,"Improved quality and capacity of the public transit system, while reducing the fleet’s carbon emissions.",HALTON,Central,,,,"$8,160,000 ",Yes,Yes,Yes,,,,,
Transit,Transportation,OAKVILLE,Conventional Vehicle Replacement,Planning,23-Mar,"Purchase seven zero-emission battery-electric buses, as well as seven charging stations.","Improved quality and capacity of the public transit system, while reducing the fleet’s carbon emissions.",HALTON,Central,,,,"$8,127,500 ",Yes,Yes,Yes,,,,,
Transit,Transportation,OAKVILLE,Intelligent Transportation System and Data Feed Upgrade,Planning,2022,"Implement technology upgrades to provide bus location, arrival and departure times to transit riders via internet and a smart phone application.","Integration with the Metrolinx Triplinx planner, enabling transit users to do regional trip planning using the same technology. ",HALTON,Central,,,,"$563,000 ",Yes,Yes,Yes,,,,,
Transit,Transportation,OAKVILLE,Integrated Conventional Scheduling Software,Planning,2022,Purchase an automated service scheduling and dispatch system.,Improved transit services scheculing and quality of service. ,HALTON,Central,,,,"$670,000 ",Yes,Yes,Yes,,,,,
Transit,Transportation,OAKVILLE,Onboard WiFi System ,Planning,2022,"Install WiFi on 107 conventional and 20 specialized buses, enabling transit users to have onboard mobile device connectivity and live streaming of onboard video during emergencies. ",Improved safety and convenience of the public transit system for customers and staff. ,HALTON,Central,,,,"$882,000 ",Yes,Yes,Yes,,,,,
Transit,Transportation,OAKVILLE,Lakeshore West Corridor Expansion - Kerr Street Grade Separation,Planning,To Be Determined,GO Expansion - Early Works,"To support future increases in GO rail service, Metrolinx will build a road under rail underpass that will shift and lower Kerr Street below the rail corridor between Speers Road and Wyecroft Road.",HALTON,Central,,,,0,,,,,https://www.metrolinx.com/en/greaterregion/projects/kerr-street-underpass.aspx,43.44820075,-79.68948431,
Communities,Infrastructure,OBASHKAANDAGAANG FIRST NATION,Rehabilitation to the Water Treatment Plant,Under construction,23-Sep,"Restore the plant's communications, adding monitoring controls, in-line turbidity and chlorine residual analyzer. ",Reduced risk of water contamination.,,Northwest,,,,"$84,711 ",,Yes,Yes,Yes,,49.713605,-94.585469,
Communities,Infrastructure,OBASHKAANDAGAANG FIRST NATION,Replace Existing Distribution Water Main at West End WTP and Upgrade 10 Residential Septic Fields,Planning,2022,"These investments will ensure access to safe, drinkable water and better environmental protection for First Nation communities across Ontario.",,,Northwest,Box 625,P0X1C0,,"$2,790,632 ",Yes,Yes,Yes,,,49.709837,-94.60089,
Communities,Infrastructure,OJIBWAY NATION OF SAUGEEN FIRST NATION,Well Upgrades,Planning,2022,"These investments will ensure access to safe, drinkable water and better environmental protection for First Nation communities across Ontario.",,,Northwest,91 sapay street,P0V2S0,,"$1,319,112 ",Yes,Yes,Yes,,,50.5,-90.76,
Communities,Infrastructure,OJIBWAYS OF ONIGAMING FIRST NATION,Rehabilitation of Hydrants,Planning,23-May,Repair damaged hydrants in the community. ,Improved reliability of the water system.,,Northwest,,,,"$4,680 ",,Yes,Yes,Yes,,49.11104,-93.92618,
Communities,Infrastructure,OJIBWAYS OF ONIGAMING FIRST NATION,Water Treatment Plant Upgrades,Planning,23-Jun,"These investments will ensure access to safe, drinkable water and better environmental protection for First Nation communities across Ontario.",,,Northwest,703 Ketemiikana Rd,P0X1K0,,"$2,770,979 ",Yes,Yes,Yes,,,49.18254,-93.927217,
Communities,Infrastructure,OJIBWAYS OF THE PIC RIVER FIRST NATION,Pic River Water Treatment Plant ,Planning,2022,Build a new water treatment plant.,Deliver high-quality water and better fire protection for community residents. ,,Northwest,78 Pic River Road,POT1R0,,"$2,766,749 ",Yes,Yes,Yes,,,48.614086,-86.28602,
Roads and bridges,Infrastructure,OJIBWAYS OF THE PIC RIVER FIRST NATION,Pic River Roads Rehabilitation,Planning,2021,"The rehabilitation and widening a major road will include repaving, upgraded drainage, a culvert replacement, improved pathways and a new area for school buses to pullover.",These upgrades will improve the safety of motorists and pedestrians.,,Northwest,78 Pic River Road,POT1R0,,"$2,078,707 ",Yes,Yes,Yes,,,48.605667,-86.295813,
Recreation,Infrastructure,OLIVER PAIPOONGE,Norwest Arena,Planning,2021,Repair the roof; replace the overhead door and window sealants; and repair the cooling and the heating floor brine pump. ,Improved performance and longer lifespan for the facility.,THUNDER BAY,Northwest,3250 HIGHWAY 130,P7K0B1,,"$85,408 ",Yes,Yes,Yes,,,48.3777,-89.5677,
Recreation,Infrastructure,OLIVER PAIPOONGE,Rosslyn Community Centre,Planning,2021,Rroof and exterior repairs and replacement of the HVAC unit,Improved ability to serve the community. ,THUNDER BAY,Northwest,3250 HIGHWAY 130,P7K0B1,,"$48,125 ",Yes,Yes,Yes,,,48.3644,-89.4428,
Recreation,Infrastructure,OLIVER PAIPOONGE,Accessible Customer Service Desks,Planning,2021,Replace the fire alarm control panel and install accessible customer service counters. ,Improved ability to serve the community. ,THUNDER BAY,Northwest,1 Baxendale Road,p0t2g0,,"$8,548 ",Yes,Yes,Yes,,,48.4119,-89.5025,
Recreation,Infrastructure,OLIVER PAIPOONGE,Murillo Hall,Planning,2021,Build accessible customer service desks,Better accessibility for customers,THUNDER BAY,Northwest,3250 HIGHWAY 130,P7K0B1,,"$31,500 ",Yes,Yes,Yes,,,48.4117,-89.5023,
Broadband,Infrastructure,ONTARIO,Bell Central Eastern Ontario ICON Project,Planning,24-Mar,New broadband construction by Bell,Providing reliable internet access,ONTARIO,TBD,,,,"$3,321,451 ",,Yes,,Yes,,44.9825024,-77.0658741,
Broadband,Infrastructure,ONTARIO,Wingham - West UBF Project,Planning,25-Dec,New broadband construction by Huron Communications,Providing reliable internet access,ONTARIO,TBD,,,,"$1,058,104 ",,Yes,Yes,Yes,,43.8836481,-81.4326957,
Broadband,Infrastructure,ONTARIO,Auburn UBF Project,Planning,25-Mar,New broadband construction by Huron Communications,Providing reliable internet access,ONTARIO,TBD,,,,"$690,435 ",,Yes,Yes,Yes,,43.7676167,-81.5239273,
Broadband,Infrastructure,ONTARIO,Township of Perth East UBF Project,Planning,25-Dec,New broadband construction by Mornington Communications,Providing reliable internet access,ONTARIO,TBD,,,,"$16,936,377 ",,Yes,Yes,Yes,,43.4741786,-80.8719045,
Broadband,Infrastructure,ONTARIO,Denfield Richmond UBF Project,Planning,27-Mar,New broadband construction by Quadro Communications,Providing reliable internet access,ONTARIO,TBD,,,,"$1,672,736 ",,Yes,Yes,,,43.1565467,-81.3940172,
Broadband,Infrastructure,ONTARIO,Execulink - East Zorra-Tavistock South UBF Project,Planning,27-Mar,New broadband construction by Execulink Telecom,Providing reliable internet access,ONTARIO,TBD,,,,"$3,987,739 ",,Yes,Yes,,,43.1987527,-80.7785656,
Broadband,Infrastructure,ONTARIO,Brooke Telecom - Lambton UBF Project,Planning,24-Dec,New broadband construction by Brooks Bay Cable Coproration,Providing reliable internet access,ONTARIO,TBD,,,,"$6,195,378 ",,Yes,Yes,Yes,,42.7826071,-81.9898084,
Broadband,Infrastructure,ONTARIO,Northumberland County - Broadband as an Open Access Utility Project,Planning,24-Dec,New broadband construction by Ditigal Infrastructure Group,Providing reliable internet access,ONTARIO,TBD,,,,"$108,689,040 ",,Yes,Yes,Yes,,44.1466795,-78.0164205,
Broadband,Infrastructure,ONTARIO,Rural Huron County UBF Project,Planning,25-Dec,New broadband construction by Tuckersmith Communications,Providing reliable internet access,ONTARIO,TBD,,,,"$18,455,393 ",,Yes,Yes,Yes,,43.6953002,-81.3077142,
Broadband,Infrastructure,ONTARIO,Xplornet Fibre & 5G Wireless Deployment Project,Planning,24-Sep,New broadband & 5G construction by Xplornet Communications,Providing reliable internet & 5G access,ONTARIO,TBD,,,,"$107,000,000 ",,Yes,Yes,,,44.6078667,-80.9453812,
Broadband,Infrastructure,ONTARIO,Xplornet Fibre & 5G Wireless Deployment Project,Planning,24-Jun,New broadband & 5G  construction by Xplornet Communications,Providing reliable internet & 5G access,ONTARIO,TBD,,,,"$126,878,191 ",,Yes,Yes,,,42.288833,-82.4642576,
Broadband,Infrastructure,ONTARIO,Execulink - East Zorra-Tavistock South UBF Project,Planning,27-Mar,New broadband construction by Execulink Telecom,Providing reliable internet access,ONTARIO,TBD,,,,"$7,019,719 ",,Yes,Yes,,,42.9498721,-80.8291305,
Broadband,Infrastructure,ONTARIO,Execulink - Norwich Township UBF Project,Planning,27-Mar,New broadband construction by Execulink Telecom,Providing reliable internet access,ONTARIO,TBD,,,,"$5,938,554 ",,Yes,Yes,,,42.9562886,-80.6275691,
Broadband,Infrastructure,ONTARIO,Perth South - West UBF Project,Planning,23-Dec,New broadband construction by Quadro Communications,Providing reliable internet access,ONTARIO,TBD,,,,"$3,098,600 ",,Yes,Yes,Yes,,43.2833715,-81.1167362,
Broadband,Infrastructure,ONTARIO,West Perth North UBF Project,Planning,25-Sep,New broadband construction by Quadro Communications,Providing reliable internet access,ONTARIO,TBD,,,,"$1,914,580 ",,Yes,Yes,Yes,,43.4816703,-81.1356645,
Broadband,Infrastructure,ONTARIO,West Perth South UBF Project,Planning,25-Dec,New broadband construction by Quadro Communications,Providing reliable internet access,ONTARIO,TBD,,,,"$2,384,544 ",,Yes,Yes,Yes,,43.4334201,-81.2379068,
Broadband,Infrastructure,ONTARIO,Fibre to the Homes for Underserved Residents Central and GGH,Planning,25-Apr,New broadband construction by Rogers,Providing reliable internet access,ONTARIO,TBD,,,,"$581,000,000 ",,Yes,Yes,Yes,,43.8511533,-79.8927275,
Broadband,Infrastructure,ONTARIO,Bell_807 Area_FTTP UBF Project,Planning,26-Mar,New broadband construction by Bell Canada,Providing reliable internet access,ONTARIO,TBD,,,,"$4,500,000 ",,Yes,Yes,Yes,,50.4816421,-91.9169244,
Broadband,Infrastructure,ONTARIO,Bell_Arnprior-Constance Bay-Carp_FTTP UBF Project,Planning,26-Mar,New broadband construction by Bell Canada,Providing reliable internet access,ONTARIO,TBD,,,,"$68,169,495 ",,Yes,Yes,Yes,,45.4107974,-76.2483943,
Broadband,Infrastructure,ONTARIO,Bell_Bancroft Area_FTTP UBF Project,Planning,25-Mar,New broadband construction by Bell Canada,Providing reliable internet access,ONTARIO,TBD,,,,"$63,882,221 ",,Yes,Yes,Yes,,44.8643185,-78.0560707,
Broadband,Infrastructure,ONTARIO,Bell_Barrys Bay-Eganville_FTTP UBF Project,Planning,26-Mar,New broadband construction by Bell Canada,Providing reliable internet access,ONTARIO,TBD,,,,"$43,318,000 ",,Yes,Yes,Yes,,45.4823999,-77.4651754,
Broadband,Infrastructure,ONTARIO,Bell_Bonfield-Mattawa_FTTP UBF Project,Planning,26-Mar,New broadband construction by Bell Canada,Providing reliable internet access,ONTARIO,TBD,,,,"$30,313,612 ",,Yes,Yes,Yes,,46.2574883,-78.9510593,
Broadband,Infrastructure,ONTARIO,Bell_Bracebridge Area_FTTP UBF Project ,Planning,25-Mar,New broadband construction by Bell Canada,Providing reliable internet access,ONTARIO,TBD,,,,"$68,371,520 ",,Yes,Yes,Yes,,44.949652,-79.3182434,
Broadband,Infrastructure,ONTARIO,Bell_Brockville Area_FTTP UBF Project,Planning,26-Mar,New broadband construction by Bell Canada,Providing reliable internet access,ONTARIO,TBD,,,,"$69,109,613 ",,Yes,Yes,Yes,,44.683615,-75.8275025,
