Category,Supporting Ministry,Community,Project,Status,Target Completion Date,Description,Result,Area,Region,Address,Postal Code,Highway / Transit Line,Estimated Total Budget,Municipal Funding,Provincial Funding,Federal Funding,Other Funding,Website,Latitude,Longitude,Geometry
Recreation,Infrastructure,GUELPH,Expanding and renovating accessible community space at the YMCA-YWCA of Guelph.,Planning,23-Mar,"The project involves a three storey addition to the YMCA of Guelph to provide youth recreational space and an expansion of the universal change room to enhance access to the facility for those with physical disabilities and families with young children. The expansion will add a footprint of 2,000 square feet to the facility resulting in 6,000 square feet of new space.",,WELLINGTON,Southwest,130 Woodland Glen Dr,N1G4M3,,"$2,965,848 ",,Yes,Yes,Yes,https://www.news.ontario.ca/en/release/60979/canada-and-ontario-invest-in-improved-community-and-recreation-infrastructure-in-elora-and-guelph,43.5067,-80.237,
Recreation,Infrastructure,GUELPH,Rehabilitation of a century church building and 3-storey rear addition Community Centre,Planning,2022,The rehabilitation of the 100-year-old church building and the construction of a three-storey community centre will allow HOPE House to expand its community services and operations. The work includes upgrades to the building's masonry and rehabilitating the flat roof.,,WELLINGTON,Southwest,10 CORK ST E,N1H2W8,,"$550,390 ",,Yes,Yes,Yes,https://www.news.ontario.ca/en/release/60979/canada-and-ontario-invest-in-improved-community-and-recreation-infrastructure-in-elora-and-guelph,43.544695,-80.250923,
Communities,Municipal Affairs and Housing,GUELPH,Affordable Housing,Under construction,23-Jan,27 units geared towards seniors at 395 Edinburgh Road North,"Apartments with 1, 2 bedroom/unit geared towards seniors",WELLINGTON,Southwest,395 Edinburgh Road North,N1H5H8,,"$543,430 ",Yes,Yes,Yes,Yes,,43.553184,-80.278569,
Transit,Transportation,GUELPH,Route Expansions,Planning,27-Oct,"Purchase of 30 new, long-range electric battery buses over a period of 8 years.",Increased capacity of the existing public transit bus fleet,WELLINGTON,Southwest,170 Watson Road South,N1C 1L1,,"$40,950,000 ",Yes,Yes,Yes,,,,,
Transit,Transportation,GUELPH,New Guelph Transit Storage Facility,Planning,27-Mar,"The New Guelph Transit Storage Facility (the Project) consists of the construction of a new bus storage facility for Guelph Transit in the city of Guelph, Ontario.The Project is estimated to be approximately 191,000 square feet, will store up to 200 vehicles and include electric charging infrastructure to support Guelph's transition to a zero-emission batteryelectric fleet. The facility will also include administrative offices, employee amenities and employee parking.",The Project aims to improve the capacity of the existing and future transit system by providing additional space for fleet storage which is presently constrained at Guelph's existing storage facility.,WELLINGTON,Southwest,,,,"$86,786,000 ",Yes,Yes,Yes,,,43.553138,-80.197674,
Transit,Transportation,GUELPH,Bus Fleet Electrification,Planning,27-Oct,Replace 35 diesel buses with battery electric buses.,Improved quality of the Guelph transit system and more rapid transition to a low-carbon fleet. ,WELLINGTON,Southwest,,,,"$51,030,000 ",Yes,Yes,Yes,,,,,
Transit,Transportation,GUELPH,Guelph Central Station ,Planning,27-Oct,Construct a new Guelph Transit terminal building at Guelph Central Station that meets accessibility and energy efficiency standards.,Improved quality and convenience of the public transit system.,WELLINGTON,Southwest,,,,"$7,950,000 ",Yes,Yes,Yes,,,,,
Transit,Transportation,GUELPH,Guelph - Cycling Network Expansion and Enhancements.,Planning,27-Oct,The Project consists of the construction of 13 km of on-road cycling lanes in strategic segments of Cycling Master Plan. Also includes cycling network design improvements at up to 6 major intersections.,This will improve safety for cyclists and provide direct access to the city’s public transit system,WELLINGTON,Southwest,,,,"$11,460,400 ",Yes,Yes,Yes,,,,,
Child care,Education,GUELPH-ERAMOSA,Sacred Heart Catholic Elementary School,Under construction,2022,Expansion of existing school,Addition to accommodate 49 child care spaces and 2 EarlyON rooms,WELLINGTON,Southwest,5146 7 HWY RR 4,N0B 2K0,,"$3,261,933 ",,Yes,,Yes,,43.62408,-80.15174,
Education,Education,HALDIMAND COUNTY,Caledonia Public Elementary School,Planning,24-Sep,Construction of new school,"New facility to accommodate 441 students in a growing community, including the construction of 49 child care spaces",HALDIMAND-NORFOLK,Southwest,MACLACHLAN AVE / WHITHORN CRES,,,"$12,288,985 ",,Yes,,,,43.07348954,-79.93126346,
Education,Education,HALDIMAND COUNTY,Caledonia Catholic Elementary School,Planning,24-Sep,Construction of new school,New facility to accommodate 305 students in a growing community,HALDIMAND-NORFOLK,Southwest,MACLACHLAN AVE / WHITHORN CRES,,,"$8,142,113 ",,Yes,,,,43.07348954,-79.93126346,
Broadband,Infrastructure,HALIBURTON COUNTY,Eastern Ontario Regional Network (EORN) Cellular Gap Project,Under construction,25-Aug,"Description: A regional project adding new cellular infrastructure to increase network coverage and capacity across eastern Ontario. Note that the funding listed below is for the entire project, not just this municipality. ","Expanding reliable cellular services which are essential to support economic development, improve public safety and connect with others",HALIBURTON,East,,,,"$300,000,000 ",Yes,Yes,Yes,Yes,https://www.eorn.ca/en/projects/improving-cell-service.aspx,45.047187,-78.507672,
Recreation,Infrastructure,HALIBURTON COUNTY,Upgrading of the Haliburton County Rail Trail Corridor – CCRIS,Planning,2021,"The project work includes improving 30 kilometers of trail with granular overlay; installing 15 benches, 500 meters of barrier, and informational signage to highlight trail history, the natural environment, and trail accessibility. This project will provide an improved recreational experience for users, while reducing annual maintenance costs.",,HALIBURTON,East,11 Newcastle,K0M2K0,,"$268,125 ",Yes,Yes,Yes,,https://www.news.ontario.ca/en/release/1000034/canada-and-ontario-invest-over-44-m-in-improved-culture-recreation-and-green-infrastructure-in-partnership-with-15-communities-across-ontario,45.0427,-78.5208,
Roads and bridges,Transportation,HALIBURTON COUNTY,"Coboconk to Haliburton Boundary, Kawartha Lakes",Under construction,2022,Resurfacing,,HALIBURTON,East,,,,0,,Yes,,,,44.657329,-78.79532929,
Roads and bridges,Transportation,HALTON,Bridge rehabilitation,Under construction,2022,Rehabilitate the bridge at North Shore Blvd.,,HALTON,Central,,,QEW,"$25,360,000 ",,Yes,,,,43.315108,-79.807329,
Roads and bridges,Transportation,HALTON,"Regional Rd. 25 to Credit River Bridge, Milton, Mississauga",Under construction,23-Mar,"HOV expansion, Bridge replacement, Bridge widening, Six to ten-lane widening (HOV), Six to twelve-lane widening",,HALTON,Central,,,,0,,Yes,,,,43.61246421,-79.72896009,
Roads and bridges,Infrastructure,HALTON HILLS,Glen Lawson Road and Third Line Improvements,Planning,2022,"Upgrade approximately 1.5 kilometres of Glen Lawson Road, from Fourth Line to Churchill Road South/Third Line, and Churchill Road South/Third Line, from Glen Lawson Road to Rachlin Drive in Halton Hills.",,HALTON,Central,,,,"$1,562,438 ",Yes,Yes,Yes,,,43.629582,-80.010518,
Communities,"Tourism, Culture and Sport",HALTON HILLS,Halton Hills T,Under construction,23-May,"Our Municipality, with a $305,000 Community Building Fund – Capital stream grant over 12 months, will address a community need by upgrading heating, cooling and air management units of the Acton Arena and Community Centre, extending life of the facility. ",,HALTON,Central,415 Queen Street East,L7J 2N2,,"$305,000 ",,Yes,,,,43.641499,-80.025696,
Roads and bridges,Transportation,HALTON HILLS,Bridge rehabilitation,Planning,2021,Rehabilitate the Main Street North bridge over CNR Site #13 ,,HALTON,Central,,,Highway 7,"$2,962,787 ",,Yes,,,https://www.news.ontario.ca/mto/en/2019/07/connecting-links-funding-by-municipality-3.html,43.65317,-79.93095,
Transit,Transportation,HALTON HILLS,Transit Service Strategy Implementation,Planning,24-Dec,"Purchase six new transit buses, install 36 new accessible transit shelters, and implement transit dispatching/scheduling technology.",Enhanced ridership growth to meet increasing demand for transit services.,HALTON,Central,,,,"$1,396,500 ",Yes,Yes,Yes,,,,,
Child care,Education,HAMILTON,St. Thomas the Apostle Catholic Elementary School,Under construction,23-Mar,Expansion of existing school,Addition to accommodate 49 child care spaces,HAMILTON,Central,170 SKINNER RD,L0R 2H7,,"$2,437,533 ",,Yes,,,,43.33907842,-79.87700107,
Child care,Education,HAMILTON,école élémentaire publique Pavillon de la jeunesse,Planning,2022,Expansion of existing school,Addition to accommodate 49 child care spaces,HAMILTON,Central,105 HIGH ST,L8T 3Z4,,"$1,636,562 ",,Yes,,,,43.22656,-79.82413,
Education,Education,HAMILTON,École secondaire publique Georges-P-Vanier,Planning,25-Sep,Construction of new school,New facility to accommodate 400 students as a result of a consolidation,HAMILTON,Central,36 BROUGHTON AVE,L8W 3S5,,"$13,257,763 ",,Yes,,,,43.19006314,-79.85184611,
Education,Education,HAMILTON,École secondaire catholique Mère-Teresa,Planning,25-Sep,Construction of new school,New facility to accommodate 400 students as a result of a consolidation,HAMILTON,Central,36 BROUGHTON AVE,L8W 3S5,,"$13,257,763 ",,Yes,,,,43.19006314,-79.85184611,
Education,Education,HAMILTON,St. Patrick Catholic Elementary School,Under construction,2022,Construction of new school,"New facility to accommodate 383 students as a result of a consolidation, including the construction of 49 child care spaces and of 2 EarlyON rooms",HAMILTON,Central,20 EAST AVE S,L8N 3X1,,"$16,241,486 ",,Yes,,Yes,,43.2524,-79.8558,
Education,Education,HAMILTON,Glen Brae Public Elementary School,Under construction,2022,Demolition,Full/Partial demolition of the existing facility,HAMILTON,Central,50 SECORD DR,L8K 3W7,,"$1,001,090 ",,Yes,,,,43.22772389,-79.77941698,
Education,Education,HAMILTON,Memorial Public Elementary School,Under construction,2021,Demolition,Full/Partial demolition of the existing facility,HAMILTON,Central,211 MEMORIAL AVE,L8G 3B2,,"$653,778 ",,Yes,,,,43.21665061,-79.72788913,
Education,Education,HAMILTON,Binbrook II Public Elementary School,Planning,24-Jan,Construction of new school,New facility to accommodate 615 students in a growing community,HAMILTON,Central,TBD,TBD,,"$13,528,858 ",,Yes,,,,,,
Education,Education,HAMILTON,St. James the Apostle Catholic Elementary School,Planning,23-Sep,Construction of new school,"New facility to accommodate 590 students in a growing community, including the construction of 49 child care spaces",HAMILTON,Central,29 JOHN MURRAY ST,L8J 1C5,,"$16,081,836 ",,Yes,,Yes,,43.19164615,-79.78362942,
Education,Education,HAMILTON,Nash Upper Stoney Creek Public Elementary School,Planning,23-Sep,Construction of new school,"New facility to accommodate 650 students in a growing community, including the construction of 49 child care spaces",HAMILTON,Central,FIRST RD W / GREEN MOUNTAIN RD W,,,"$16,667,921 ",,Yes,,,,43.20164186,-79.77585353,
Education,Education,HAMILTON,Guardian Angels Catholic Elementary School,Planning,23-Sep,Expansion of existing school,"New classroom addition of 118 pupil places for a growing school, including 49 child care spaces",HAMILTON,Central,705 CENTRE RD,L8N 2Z7,,"$4,451,108 ",,Yes,,,,43.34403544,-79.91437373,
Education,Education,HAMILTON,St. James the Apostle Catholic Elementary School,Planning,2022,Demolition,Full/Partial demolition of the existing facility,HAMILTON,Central,29 JOHN MURRAY ST,L8J 1C5,,"$664,040 ",,Yes,,,,43.19164615,-79.78362942,
Education,Education,HAMILTON,Bishop Ryan Catholic Secondary School,Planning,25-Sep,Expansion of existing school,New classroom addition of 253 pupil places for a growing school,HAMILTON,Central,1824 RYMAL RD,L0R 1P0,,"$8,449,198 ",,Yes,,,,43.18156,-79.81642,
Education,Education,HAMILTON,école élémentaire publique Hamilton Ouest,Planning,27-Sep,Construction of new school,"New facility to accommodate 271 underserved French-language students, including the construction of 49 child care spaces",HAMILTON,Central,TBD,L8S 3B7,,"$10,298,140 ",,Yes,,,,,,
Health care,Health,HAMILTON,Hamilton Health Sciences - Hamilton Redevelopment,Planning,28-Apr,The project involves the redevelopment and expansion of the hospital's Juravinski site.  This project will replace and upgrade components of the hospital's existing infrastructure including extensive renovations and construction of a new patient care tower.,"Replacement of aging infrastructure, increase in number of beds and expansion of hospital programs.",HAMILTON,Central,699 Concession St,L8V 5C2,,0,,Yes,,Yes,,43.571792,-79.60856,
Communities,Infrastructure,HAMILTON,Sewage pumping station rehabilitation.,Under construction,23-Sep,"Rehabilitate, repair and/or replace various equipment at the Elgin St.  Rhodes Court  and Calvin St. sewage pumping station. ",,HAMILTON,Central,"Elgin Street, Dundas FC001, Rhodes Ct. Dundas DC009, 170 Calvin St. Ancaster HC011",,,"$322,500 ",Yes,Yes,Yes,,,43.268643,-79.957646,
Recreation,Infrastructure,HAMILTON,Eva Rothwell Gymnasium Renovations,Planning,2021,"The project will renovate the gymnasium to include updated surfacing with multi-sport court lines, new adjustable basketball nets, and improvements to safety features including foam padding to areas under the net and stage area to reduce the risk of injury during activities. These upgrades will improve the quality of physical literacy programming, the safety of the gymnasium floor, and reduce barriers for persons with disabilities.",,HAMILTON,Central,460 WENTWORTH ST N,L8L5W8,,"$67,039 ",,Yes,Yes,Yes,https://www.news.ontario.ca/en/release/1000026/canada-and-ontario-invest-to-improve-recreational-facilities-in-hamilton,43.265089,-79.843012,
Recreation,Infrastructure,HAMILTON,Central Memorial Recreation Centre Elevator Modernization and Replacement,Planning,2022,"The project will replace the elevator at the Central Memorial Recreation Centre in Hamilton. Various components of the elevator will be replaced including wiring and control systems, the car and cabin interior, fixtures, door equipment, hall button panels, and the valve, pump and tank.",,HAMILTON,Central,71 Main Street West,L8P4Y5,,"$400,000 ",Yes,Yes,Yes,,https://www.news.ontario.ca/en/release/1000026/canada-and-ontario-invest-to-improve-recreational-facilities-in-hamilton,43.249326,-79.85932,
Recreation,Infrastructure,HAMILTON,Hamilton Amateur Athletic Association Park Redevelopment,Planning,25-Mar,"The project will create barrier-free accessible pathways throughout the park, improve drainage for better grass growth, and upgrade the lighting to LED. The playground and spray pad amenities will also be upgraded to replace assets that have reached end-of-life.",,HAMILTON,Central,71 Main Street West,L8P4Y5,,"$3,581,997 ",Yes,Yes,Yes,,https://www.news.ontario.ca/en/release/1000026/canada-and-ontario-invest-to-improve-recreational-facilities-in-hamilton,43.253549,-79.883713,
Recreation,Infrastructure,HAMILTON,Recreation Facility Roof Replacements and Retrofits,Planning,24-Mar,"The project will repair and replace roofs at the Mohawk Ice Centre, Benneto Community Centre, Dundas Community Pool, and Chedoke Golf Club. These improvements will extend the life of these recreational facilities for years to come.",,HAMILTON,Central,71 Main Street West,L8P4Y5,,"$4,400,000 ",Yes,Yes,Yes,,https://www.news.ontario.ca/en/release/1000026/canada-and-ontario-invest-to-improve-recreational-facilities-in-hamilton,43.270204,-79.861251,
Recreation,Infrastructure,HAMILTON,Improvement and Repairs to the Royal Botanical Gardens in Burlington,Planning,24-Nov,"Project work will include reconstructing a boathouse, a viewing platform and boardwalk; repairing nature trails and garden paths; and installing an entry gate for the Hendrie Valley Trails. Improvements also include enlarging the Rock Trail parking lot and making it more accessible, and updating wayfinding signage and audio units to adhere to the Accessibility for Ontarians with Disabilities Act. These improvements and upgrades will create a more safe and accessible space, while also providing a more enjoyable visitor experience.",,HAMILTON,Central,680 Plains Road West,L7T4H4,,"$2,270,626 ",,Yes,Yes,Yes,https://www.news.ontario.ca/en/release/1000136/canada-and-ontario-invest-22m-in-improvement-and-repairs-to-the-royal-botanical-gardens-in-burlington,43.288484,-79.891297,
Recreation,Infrastructure,HAMILTON,Griffin House National Historic Site,Planning,25-Feb,"The project will restore the interior structure and finishes, as well as the major components of the building's exterior, including the foundation, siding, windows, roof and chimney. Additional improvements to the pathways and the installation of porch ramps will make the building accessible to all visitors. ","These upgrades to an important cultural and historical landmark of Black settlement in Upper Canada will improve accessibility for all visitors, while restoring the heritage features of the house built in 1827.",HAMILTON,Central,71 Main Street West,L8P4Y5,,"$999,900 ",Yes,Yes,Yes,,,43.2557,-79.9711,
Recreation,Infrastructure,HAMILTON,Ancaster Agricultural Society Fairgrounds,Planning,2021,"Addition of a new 75,000 square foot building to accommodate larger agriculture events, as well as fairs and concerts. ","The new heated building will allow the Ancaster Agricultural Society to host quality events all year round, creating jobs, and supporting the local economy.",HAMILTON,Central,630 Trinity Road,L0R1R0,,"$4,031,250 ",Yes,Yes,Yes,Yes,,43.188809,-80.042251,
Recreation,Infrastructure,HAMILTON,Hamilton Children's Museum,Planning,24-Nov,"Construct a 2,600 square foot addition to the Hamilton Children's Museum.",Create a larger and more accessible learning space.,HAMILTON,Central,1072 Main Street East,L8M1N6,,"$3,520,000 ",Yes,Yes,Yes,,,43.2435,-79.8258,
Recreation,Infrastructure,HAMILTON,Dundas Valley School of Arts,Planning,2021,"Rehabilitate and repair the facility including the lighting system, air distribution system ducts, HVAC units, etc. ",,HAMILTON,Central,21 Ogilvie Street,L9H2S1,,"$199,609 ",Yes,Yes,Yes,,,43.264806,-79.943185,
Recreation,"Tourism, Culture and Sport",HAMILTON,Hamilton C,Under construction,23-Jan,"Our Municipality, with a $500,000 Community Building Fund – Capital stream grant over 12 months, will address a community need by replacing aged splash pad and infrastructure at Eastwood Park with a new, safe, accessible and efficient splash pad for extended community use. ",,HAMILTON,Central,111 Burlington Street East,L8L 4G9,,"$500,000 ",,Yes,,,,43.271704,-79.855631,
Communities,Transportation,HAMILTON,Electric Vehicle Charging Station at Centre on Barton,Planning,To Be Determined,Installation of an electric vehicle charging station,1 Level 2 charging station,HAMILTON,Central,1275 Barton St E,,,0,,,,,,43.25068,-79.80779,
Transit,Transportation,HAMILTON,Dispatching and AVL Hardware and Software Replacement,Planning,23-Dec,"Replace the mobile data terminals and stop announcement hardware, multiple video screens and PA systems and dispatching and AVL hardware on 267 buses. ",Improved quality and safety of the transit system,HAMILTON,Central,,,,"$9,000,000 ",Yes,Yes,Yes,,,,,
Transit,Transportation,HAMILTON,Construction of Active Transportation Connections,Planning,27-Oct,"Project consists of seven strategic active transportation elements. These include: •	a 185m active transportation bridge that crosses the Lincoln Alexander Parkway, connecting McQuesten Park and Limeridge Mall, •	1.4 km of new cycle tracks along Bay Street;•	1.2 km Mountain Brow multi-use path;•	2.2 km Dundas St. multi-use path;•	Approximately 17.765 km of new sidewalks in various locations;•	500 new bicycle parking spaces; and•	30 new bike-share stations.",Improved capacity,HAMILTON,Central,,,,"$9,800,000 ",Yes,Yes,Yes,,,,,
Transit,Transportation,HAMILTON,Implement Priority Bus Measures along A-Line Corridor,Planning,27-Mar,"Project scope to include 5 new queue jump lanes, transit signal priority at ~26 intersections and customer amenity enhancements including enhanced shelters, real time bus info, seating and street furniture at approximately 19 transit stops along the corridor. Also includes approximately 17.7 linear kilometres of new sidewalk along 12 different segments of roadway.",Improved capacity,HAMILTON,Central,,,,"$8,500,000 ",Yes,Yes,Yes,,,,,
Transit,Transportation,HAMILTON,Replacement of Birch Avenue Bridge and Associated Road Works/Construction of Salt Management Facility,Planning,27-Oct,"The project involves replacing a rail bridge, completing associated road works, and constructing a salt management facility. The associated road works include the reconstruction of 800 metres of roadway to: lower the road elevation to meet MTO clearance standards, install a storm water pump station and applicable pipe reconfiguration to manage road drainage, upgrade approximately 97 metres of water main in coordination with road/bridge work to support the new MSF, and to convert the roadway to two-way traffic flow. In addition, the project will also construct a salt management facility to replace the current facility to be demolished at the site of the new MSF.",Improved Quality and/or safety of existing or future transit systems.,HAMILTON,Central,,,,"$39,965,000 ",Yes,Yes,Yes,,,,,
Transit,Transportation,HAMILTON,Expansion of Transit Fleet to Support Service Growth,Planning,27-Oct,Theis project includes the purchase of up to 85 forty-foot Compressed Natural Gas buses.,Improved capacity of public transit infrastructure.,HAMILTON,Central,,,,"$73,334,000 ",Yes,Yes,Yes,,,,,
Transit,Transportation,HAMILTON,Replacement of Transit Fleet,Planning,27-Oct,This project includes the procurement of approximately 72 forty-foot Compressed Natural Gas (CNG) buses and 20 sixty-foot CNG buses to replace buses that have reached the end of their lifecycle.,Improved capacity of public transit infrastructure.,HAMILTON,Central,,,,"$114,076,999 ",Yes,Yes,Yes,,,,,
Transit,Transportation,HAMILTON,New Maintenance & Storage Facility,Planning,25-Aug,"The project scope includes construction of a new, sixty thousand (60,000) square meter (sq. m) maintenance and storage facility with major project components such as:- a thirty (30) bay maintenance area,- two (2) indoor compressed natural gas fueling lanes,- two (2) bus wash rack systems,- storage for two hundred (200) conventional size buses,- approximately 4000 sq. m of administration space, and- a four (4) level parking structure to accommodate approximately four hundred (400) parking spaces for employees.",Improved capacity of public transit infrastructure.,HAMILTON,Central,,,,"$264,295,000 ",Yes,Yes,Yes,,,,,
Transit,Transportation,HAMILTON,LRT-Hamilton ,Planning,To Be Determined,New Rapid Transit Line,"The Ontario government and the federal government will be contributing $1.7 billion to advance the Hamilton Light Rail Transit (LRT) project. Through this partnership, the province and federal government are taking a significant step towards advancing this shovel-ready LRT project that will offer frequent and reliable connections on the 14-kilometre line from Eastgate Square through downtown Hamilton to McMaster University.",HAMILTON,Central,,,,"$3,400,000,000 ",,Yes,Yes,,,43.251325,-79.838424,
Transit,Transportation,HAMILTON,Lakeshore West Corridor - Confederation GO Station,Planning,To Be Determined,GO Expansion - Early Works,New GO Station in Hamilton on Lakeshore West Corridor.,HAMILTON,Central,397 Centennial Parkway,,,0,,,,,http://www.metrolinx.com/en/greaterregion/projects/confederation-go.aspx,43.24215052,-79.75972558,
Recreation,Infrastructure,HANOVER,Trail Bridges Replacement  Hanover Community Trails System,Planning,23-Sep,"The project will replace three trail bridges and rehabilitate another in the Hanover Community Trails System. The trail rehabilitation will improve the quality and accessibility of recreational infrastructure, and will promote active transportation.",,GREY,Southwest,341 10th Street/Rue,N4N1P5,,"$2,151,600 ",Yes,Yes,Yes,,https://www.news.ontario.ca/en/release/61048/30-bundle-en,44.142523,-81.039196,
Roads and bridges,Infrastructure,HANOVER,Roundabout Construction,Planning,24-Jul,Construct a roundabout at the intersection of Grey County Roads 3 and 4 in West Grey. ,,GREY,Southwest,,,,"$1,516,606 ",Yes,Yes,Yes,,,44.157,-80.954,
Recreation,"Tourism, Culture and Sport",HANOVER,Hanover T,Under construction,23-Feb,"Our Municipality, with a $160,700 Community Building Fund – Capital stream grant over 12 months, will address a community need by purchasing and installing accessible playground equipment for two community parks to replace outdated equipment and improve accessibility for community members. ",,GREY,Southwest,310 17th Avenue,NAN 0A1,,"$160,700 ",,Yes,,,,44.150361,-81.017118,
Communities,Transportation,HANOVER,Electric Vehicle Charging Station at Sarnia Harbour,Planning,To Be Determined,Installation of an electric vehicle charging station,1 Level 3 charging station,GREY,Southwest,639 10th St,,,0,,,,,,44.1536,-81.01525,
Transit,Transportation,HANOVER,Specialized Transit Vehicles,Planning,23-Dec,Purchase 8 vans and 3 buses.,Improved safety and quality of the system.,GREY,Southwest,,,,"$821,563 ",Yes,Yes,Yes,,,,,
