Category,Supporting Ministry,Community,Project,Status,Target Completion Date,Description,Result,Area,Region,Address,Postal Code,Highway / Transit Line,Estimated Total Budget,Municipal Funding,Provincial Funding,Federal Funding,Other Funding,Website,Latitude,Longitude,Geometry
Health care,Health,THUNDER BAY,Thunder Bay Regional Health Sciences Centre - Cardiovascular Surgery Program,Planning,25-Mar,"The Project involves new construction and renovation of space at Thunder Bay Regional Health Sciences Centre and includes a cardiovascular surgical inpatient unit, an additional operating room, a vascular lab and outpatient clinic.",Improved access to cardiovascular surgery and related services for residents of Thunder Bay and Northwestern Ontario.,THUNDER BAY,Northwest,980 Oliver Rd,P7B 6V4,,0,,Yes,,Yes,,48.428793,-89.269491,
Broadband,Infrastructure,THUNDER BAY,Lakehead Rural Municipal Coalition (LRMC) Broadband Project,Planning,24-May,New broadband construction by Northwestern Ontario Innovation Centre,Providing reliable internet access,THUNDER BAY,Northwest,,,,"$41,051,180 ",,Yes,Yes,,,48.3287016,-89.5964965,
Recreation,Infrastructure,THUNDER BAY,Waterfront Phase II - Prince Arthur's Landing Festival Area Improvements,Planning,26-Mar,"Renovations to Thunder Bay’s outdoor festival area to reorient the stage and viewing area, upgrade the electrical and backstage infrastructure for event and concert hosting, and help improve the health and safety of employees, performers and improve the spectator experience.",,THUNDER BAY,Northwest,500 Donald Street East,P7C5K4,,"$4,999,998 ",Yes,Yes,Yes,,https://www.news.ontario.ca/en/release/1000516/canada-and-ontario-invest-over-66-million-in-six-recreation-infrastructure-projects-in-the-provinces-northwest-region,48.435809,-89.21468,
Recreation,Infrastructure,THUNDER BAY,Rehabilitation and renovation of the Centre Francophone in Thunder Bay,Planning,2022,"The renovation and expansion of the Centre Francophone, including the construction of a second floor, rehabilitation of the garage, replacement of the roof, renovation of the community hall to expand capacity, and addressing accessibility requirements throughout the building. This includes updates to the bathroom, elevator, ramps, and doors.",,THUNDER BAY,Northwest,234 VAN NORMAN ST,P7A4B8,,"$702,257 ",,Yes,Yes,Yes,https://www.news.ontario.ca/en/release/1000516/canada-and-ontario-invest-over-66-million-in-six-recreation-infrastructure-projects-in-the-provinces-northwest-region,48.436545,-89.220276,
Broadband,Mines,THUNDER BAY,Broadband Infrastructure Development ,Under construction,23-Mar,Providing internet access to remote Matawa-member First Nations communities,"Improved internet connectivity for community members and improved acceess to education, training and business opportunities.",THUNDER BAY,Northwest,"233 S. Court Street, 2nd Floor",P7B 2X9,,"$69,200,000 ",,Yes,Yes,,,48.427861,-89.230088,
Communities,Transportation,THUNDER BAY,Electric Vehicle Charging Station at Scotiabank,Planning,To Be Determined,Installation of an electric vehicle charging station,1 Level 3 charging station,THUNDER BAY,Northwest,770 Memorial Ave,,,0,,,,,,48.41299,-89.24483,
Transit,Transportation,THUNDER BAY,Conventional and Specialized Vehicle Replacement,Planning,23-Dec,Purchase 4 diesel transit buses and 12 diesel paratransit  buses to replace existing buses that have reached the end of their asset life.,Reduced service disruptions and maintenance costs while providing users with a smoother and more reliable transit experience.,THUNDER BAY,Northwest,,,,"$4,914,000 ",Yes,Yes,Yes,,,,,
Transit,Transportation,THUNDER BAY,Specialized Fleet Expansion,Planning,2021,Purchase 2 specialized service buses.,Improved capacity and access to specialized transit services in the City of Thunder Bay.,THUNDER BAY,Northwest,,,,"$399,000 ",Yes,Yes,Yes,,,,,
Transit,Transportation,THUNDER BAY,Transit Hub Improvements,Planning,27-Mar,"Upgrades to four transit hubs, including widening of sidewalks, automatic door installation, real-time passenger information screens and heated shelters, along with the construction of a new transit hub.",Improved passenger accessibility and overall quality of the public transit system.,THUNDER BAY,Northwest,,,,"$8,190,000 ",Yes,Yes,Yes,,,48.380895,-89.247682,
Transit,Transportation,THUNDER BAY,Vehicle Refurbishment,Planning,22-Dec,"Replace several interior components on several buses, including engines, transmissions, and seating. ","Improved capacity, quality and safety of existing and future transit systems.",THUNDER BAY,Northwest,,,,"$1,086,750 ",Yes,Yes,Yes,,,48.416701,-89.236474,
Transit,Transportation,THUNDER BAY,Transit Facility Improvements,Planning,23-Dec,"Rehabilitating the public transit garage will include replacements of overheard doors, a section of the roof and other components. The replacements will decrease operating costs, provide a safer work environment and extend the life of the garage.",Rehabilitating the transit garage including the replacement of overhead doors and the replacement of a section of the roof. This will reduce operating costs and ensures the extension of useful life of the asset. ,THUNDER BAY,Northwest,,,,"$702,240 ",Yes,Yes,Yes,,,48.416701,-89.236474,
Transit,Transportation,THUNDER BAY,Safety Equipment,Planning,23-Jul,"Install new safety equipment on public transit buses, including driver safety shields and mobility securement devices for wheelchairs and strollers.",Improved safety and prevent passenger injuries.,THUNDER BAY,Northwest,,,,"$1,062,600 ",Yes,Yes,Yes,,,48.416701,-89.236474,
Transit,Transportation,THUNDER BAY,New Pedestrian Crossovers,Planning,26-Nov,Construct 23 new pedestrian crossovers in various high traffic areas. ,Improved service quality and safety for transit users.,THUNDER BAY,Northwest,,,,"$2,186,250 ",Yes,Yes,Yes,,,48.3809,-89.2477,
Transit,Transportation,THUNDER BAY,Mobility System Hardware,Planning,23-Dec,Replace CCTV and intelligent transportation system equipment in 48 conventional and 25 specialized buses.,Improved service quality and safety for transit users.,THUNDER BAY,Northwest,,,,"$483,000 ",Yes,Yes,Yes,,,48.416701,-89.236474,
Transit,Transportation,THUNDER BAY,Electronic Fare Management System,Planning,23-Dec,Install a new automated electronic fare management system on 48 conventional and 25 adapted buses.,More convenient payment options for passengers through the introduction of reloadable and pre-paid smart cards.,THUNDER BAY,Northwest,,,,"$2,625,000 ",Yes,Yes,Yes,,,48.416701,-89.236474,
Transit,Transportation,THUNDER BAY,On-demand Trip Management Software,Planning,2022,"Introduce new on-demand/shared ride electronic software features that includes booking, payment and notifications through a web portal and mobile app.",Improved accessibility and convenience for transit users. ,THUNDER BAY,Northwest,,,,"$315,000 ",Yes,Yes,Yes,,,48.416701,-89.236474,
Transit,Transportation,THUNDER BAY,Pedestrian Crossovers,Planning,23-Nov,Construct 23 pedestrian crossovers in high traffic areas throughout Thunder Bay. ,"Improved accessibility, safety and overall quality of the public transit system.",THUNDER BAY,Northwest,,,,"$1,380,500 ",Yes,Yes,Yes,,,48.3809,-89.2477,
Transit,Transportation,THUNDER BAY,Transit Bus Stop Improvements,Planning,27-Mar,Install 40 new bus shelters and 378 new mobility hard surface pads.,Improved passenger experience by rehabilitating sidewalk connections and waiting areas at bus stops.,THUNDER BAY,Northwest,,,,"$1,934,100 ",Yes,Yes,Yes,,,48.380895,-89.247682,
Transit,Transportation,THUNDER BAY,Transit Fleet Maintenance Equipment,Planning,23-Dec,Replace and update old transit fleet maintenance vehicles and equipment.,Safer working conditions for employees and improved safety and support for transit users.,THUNDER BAY,Northwest,,,,"$278,250 ",Yes,Yes,Yes,,,48.416701,-89.236474,
Education,Education,THUNDER BAY DISTRICT,Savant Lake Public Elementary School,Planning,23-Sep,Construction of new school,New replacement facility to accommodate 95 students,THUNDER BAY,Northwest,FIRST ST,POV 2S0,,"$4,750,222 ",,Yes,,,,,,
Communities,Transportation,THUNDER BAY DISTRICT,"Rest area at Hwy 17/614 junction, south of Manitouwadge",Under construction,2022,New rest area facility construction at Hwy 17/614,New facility,THUNDER BAY,Northwest,,,Highway 614,0,,Yes,,,,48.704801,-85.858741,
Communities,Transportation,THUNDER BAY DISTRICT,"Rest area on Hwy 17, Argon Park west of Thunder Bay",Under construction,2022,Rest area improvements on Hwy 17 Argon Park,Facility improvements,THUNDER BAY,Northwest,,,Highway 17,0,,Yes,,,,48.90255301,-90.02826177,
Roads and bridges,Transportation,THUNDER BAY DISTRICT,Expanding Coughlin Road to 4 lanes,Planning,26-Sep,Expand Coughlin Road to 4 lanes for 6.5 km from west of Black Sturgeon River Bridge to Highway 582,,THUNDER BAY,Northwest,,,Hwy 11/17 Thunder Bay to Nipigon Corridor,0,,Yes,Yes,,,,,
Roads and bridges,Transportation,THUNDER BAY DISTRICT,"White River Bridge at Bremner, 18 km west of Hwy 631, west of White River",Under construction,2022,Bridge replacement,,THUNDER BAY,Northwest,,,,0,,Yes,,,,48.666961,-85.46552,
Recreation,Infrastructure,TILLSONBURG,Tillsonburg Community Centre Rehabilitation Project,Planning,23-Dec,"Replacement of the pool area’s tile floors, deck and line, pool roof, pool mechanicals, and lighting, expanding the pool change room for family and gender neutral accessibility, as well as the installation of a new ramp entry into the pool, and the construction of a new 3,600 sq. ft. outdoor splash pad.",,OXFORD,Southwest,Floor 2nd 200 Broadway Street/Rue,N4G5A7,,"$4,999,503 ",Yes,Yes,Yes,,https://www.news.ontario.ca/en/release/1000470/canada-and-ontario-invest-over-35-million-in-35-recreational-and-community-infrastructure-projects,42.87169,-80.73595,
Recreation,"Tourism, Culture and Sport",TILLSONBURG,Tillsonburg T,Under construction,23-Apr,"Our Municipality, with a $148,500 Community Building Fund – Capital stream grant over 12 months, will address a community need by installing automatic doors with new frames and hardware, and renovating the electrical work to improve accessibility at our Community Centre. ",,OXFORD,Southwest,45 Hardy Avenue,N4G 3W9,,"$148,500 ",,Yes,,,,42.871629,-80.735552,
Communities,Transportation,TILLSONBURG,Electric Vehicle Charging Station at Tim Horton's,Planning,To Be Determined,Installation of an electric vehicle charging station,1 Level 3 charging station,OXFORD,Southwest,401 Simcoe St,,,0,,,,,,42.85364,-80.6938,
Communities,Transportation,TILLSONBURG,Electric Vehicle Charging Station at Tim Horton's,Planning,To Be Determined,Installation of an electric vehicle charging station,1 Level 3 charging station,OXFORD,Southwest,560 Broadway St,,,0,,,,,,42.87726,-80.74447,
Roads and bridges,Transportation,TILLSONBURG,Road reconstuction,Planning,2021,Reconstruct Oxford Street and Simcoe Street from Broadway Street to Vienna Road.,,OXFORD,Southwest,,,Highway 19,"$1,578,461 ",,Yes,,,,42.860074,-80.721539,
Roads and bridges,Transportation,TILLSONBURG,Rehabilitation of Vienna Road ,Under construction,23-Mar,,,OXFORD,Southwest,,,19,"$1,729,760 ",,Yes,,,,42.854685,-80.719872,
Roads and bridges,Transportation,TIMISKAMING DISTRICT,Hwy 66 from Kirkland Lake easterly to west of Hwy 624,Under construction,2022,"Resurfacing and fully paved shoulder on Hwy 66 from Hwy 672 to Hwy 624, Bridge rehabilitation of Misema River Bridge ","Bridge rehabilitation, Resurfacing, Paved shoulders",TIMISKAMING,Northeast,,,Highway 66,0,,Yes,,,,48.105769,-79.74298961,
Roads and bridges,Transportation,TIMISKAMING DISTRICT,East junction Hwy 560 Elk Lake to east of Hwy 562,Under construction,2022,Resurfacing,,TIMISKAMING,Northeast,,,,0,,Yes,,,,47.63866614,-79.99653913,
Roads and bridges,Transportation,TIMISKAMING DISTRICT,"Montreal River Bridges, west and east of Matachewan",Under construction,2022,"Bridge rehabilitation, Bridge replacement",,TIMISKAMING,Northeast,,,,0,,Yes,,,,48.00513,-80.74191,
Child care,Education,TIMMINS,St. Joseph Catholic Elementary School,Under construction,24-Sep,Expansion of existing school,Addition to accommodate 49 child care spaces,COCHRANE,Northeast,207 HUOT ST,P0N 1H0,,"$4,276,200 ",,Yes,,,,48.4839,-81.2059,
Recreation,Infrastructure,TIMMINS,McIntyre Headframe Restoration,Planning,2020,"Restoration will include the selection of bidding contractors, detailed engineering designs and drawings, the replacement of the corroded structural steel and wood frame, and the repair of loose cladding and wall anchor backets on the exterior of the headframe.",,COCHRANE,Northeast,220 Algonquin Boulevard/Boulevard East/Est,P4N1B3,,"$1,642,394 ",Yes,Yes,Yes,,https://www.news.ontario.ca/en/release/1000470/canada-and-ontario-invest-over-35-million-in-35-recreational-and-community-infrastructure-projects,48.482387,-81.29641,
Recreation,Infrastructure,TIMMINS,YMCA of Timmins Renovation: Strengthening Impact in and for our community,Planning,2022,"Renovations to the Timmins Family YMCA include exterior renovations to solve the crumbling façade and lack of insulation, and will also include improvements to the building’s overall accessibility. Insulation and new cladding will be added to the outside of the building. Two exterior cement stairways will also be fixed.",,COCHRANE,Northeast,376 Avenue Avenue,P4N4S4,,"$562,500 ",,Yes,Yes,Yes,https://www.news.ontario.ca/en/release/1000470/canada-and-ontario-invest-over-35-million-in-35-recreational-and-community-infrastructure-projects,48.4788,-81.3467,
Recreation,Infrastructure,TIMMINS,Ski Resort Terrain Development for Increased Accessibility,Planning,2021,"Expansion of the snow making system infrastructure to enhance capacity and efficiency while utilizing new modern technologies, and constructing a downhill mountain bike trail system and operation to create additional off-season sustainability and continue to grow activities.",,COCHRANE,Northeast,5050 Kamiskotia Road,P4N7G7,,"$325,500 ",,Yes,Yes,Yes,https://www.news.ontario.ca/en/release/1000470/canada-and-ontario-invest-over-35-million-in-35-recreational-and-community-infrastructure-projects,48.534406,-81.541088,
Communities,Northern Development,TIMMINS,Centre Culturel La-Ronde,Under construction,23-Jan,Construction of new building,"Construction of a new building supporting the arts and culture sectors of the community, as well as the economy of Timmins and surrounding area.",COCHRANE,Northeast,32 Mountjoy Street North,P4N 4V6,,"$6,500,000 ",,Yes,Yes,Yes,https://www.northernontario.ctvnews.ca/video?clipId=2479270,48.476107,-81.3352867,
Communities,Transportation,TIMMINS,Electric Vehicle Charging Station at Scotiabank,Planning,To Be Determined,Installation of an electric vehicle charging station,1 Level 3 charging station,COCHRANE,Northeast,520-522 Algonquin Blvd E,,,0,,,,,,48.47733,-81.31968,
Transit,Transportation,TIMMINS,Accessible Paratransit Mobility Buses,Planning,2021,The purchase of one specialized transit vehicle to replace existing vehicles in the City of Timmins paratransit serivce that have reached the end of their useful life. ,"This project will improve the capacity, quality and safety of the specialized transit services in the City of Timmins.",COCHRANE,Northeast,,,,"$160,000 ",Yes,Yes,Yes,,,48.458878,-81.328874,
Transit,Transportation,TIMMINS,Transit Terminal Renovations,Planning,2022,"Add fully accessible washrooms, modernize the building and ensure the amenities are barrier free for all transit users.",Improved accessibility of the transit terminal.,COCHRANE,Northeast,,,,"$1,375,000 ",Yes,Yes,Yes,,,48.474841,-81.326832,
Transit,Transportation,TIMMINS,Bus Washing System,Planning,2021,Construct a bus washing facility.,Reduced energy consumption and  expanded washing capabilities.,COCHRANE,Northeast,,,,"$240,000 ",Yes,Yes,Yes,,,48.458878,-81.328874,
Child care,Education,TINY,École élémentaire catholique Sainte-Croix,Under construction,2021,Renovation of existing school,Renovation to accommodate 39 child care spaces,SIMCOE,Central,1-351 RUE LAFONTAINE RD W,L9M 0H1,,"$529,379 ",,Yes,,,,44.75734161,-80.05360254,
Recreation,Infrastructure,TINY,Toanche Recreation Pavilion,Planning,24-Sep,"The project will replace the skating rink at Toanche Park with a covered skating pavilion with open sides and natural ice, and construct a support building with restrooms, changerooms, storage and a community meeting room. The upgrades will provide local and area residents with better access to the facility.",,SIMCOE,Central,130 Balm Beach Road West/Ouest,L0L2J0,,"$792,000 ",Yes,Yes,Yes,,https://www.news.ontario.ca/en/release/61048/30-bundle-en,44.8161,-79.9503,
Communities,Attorney General,TORONTO,New courthouse in Toronto,Under construction,22-Dec,New provincial courthouse,Improved justice services to Torontonians in state-of-the-art facility,TORONTO,Central,10 Armoury St,,,"$956,400,000 ",,Yes,,,http://www.infrastructureontario.ca/New-Toronto-Courthouse/,43.653618,-79.3862,
Communities,Attorney General,TORONTO,Toronto Region Bail Centre,Under construction,2022,"Renovation of existing courthouse at 2201 Finch Ave. W.  This project is being  delivered  with the Brampton Courthouse Addition Phase 2 as a P3 bundle, and the project budget of $82.3M includes both projects.",Accommodation of the bail program associated with the new Toronto courthouse. ,TORONTO,Central,2201 Finch Ave. W.,M9M 2Y9,,"$82,500,000 ",,Yes,,,,43.752606,-79.536505,
Child care,Education,TORONTO,Bala Avenue Public Elementary School,Planning,24-Apr,Expansion of existing school,Addition to accommodate 49 child care spaces,TORONTO,Central,6 BALA AVE,M6M 2E1,,"$1,542,761 ",,Yes,,,,43.6894,-79.49938,
Child care,Education,TORONTO,Chalkfarm Public Elementary School,Planning,24-Apr,Expansion of existing school,Addition to accommodate 49 child care spaces,TORONTO,Central,100 CHALKFARM DR,M3L 1L4,,"$1,542,761 ",,Yes,,,,43.7272629,-79.5145725,
Child care,Education,TORONTO,Gracedale Public Elementary School,Under construction,24-Jan,Expansion of existing school,Addition to accommodate 49 child care spaces,TORONTO,Central,186 GRACEDALE BLVD,M9L 2C1,,"$3,466,800 ",,Yes,,Yes,,43.7532767,-79.5622093,
Child care,Education,TORONTO,Macklin Public Elementary School,Under construction,24-Jan,Expansion of existing school,Addition to accommodate 49 child care spaces,TORONTO,Central,136 INGLETON BLVD,M1V 2Y4,,"$2,981,075 ",,Yes,,Yes,,43.8220934,-79.2675445,
Child care,Education,TORONTO,Miliken Public Elementary School,Under construction,24-Jan,Expansion of existing school,Addition to accommodate 49 child care spaces,TORONTO,Central,130 PORT ROYAL TRAIL,M1V 2T4,,"$2,587,049 ",,Yes,,Yes,,43.81658,-79.28848,
Child care,Education,TORONTO,Pelmo Park Public Elementary School,Planning,24-Apr,Expansion of existing school,Addition to accommodate 49 child care spaces,TORONTO,Central,180 GARY DR,M9N 2M1,,"$1,542,761 ",,Yes,,,,43.7123639,-79.5176069,
Child care,Education,TORONTO,Holy Family Catholic Elementary School,Planning,23-Jan,Renovation of existing school,Renovation to accommodate 49 child care spaces,TORONTO,Central,141 CLOSE AVE,M6K 2V6,,"$794,068 ",,Yes,,,,43.63845,-79.43498,
Child care,Education,TORONTO,Nativity of Our Lord Catholic Elementary School,Planning,23-Sep,Expansion of existing school,Addition to accommodate 88 child care spaces,TORONTO,Central,35 SAFFRON CRES,M9C 3T8,,"$2,571,267 ",,Yes,,,,43.65348,-79.5758,
Child care,Education,TORONTO,St. Albert Catholic Elementary School,Planning,25-Sep,Expansion of existing school,Addition to accommodate 88 child care spaces,TORONTO,Central,1125 MIDLAND AVE,M1K 4H2,,"$2,571,267 ",,Yes,,,,43.74377,-79.26131,
Child care,Education,TORONTO,St. John Vianney Catholic Elementary School,Planning,23-Sep,Renovation of existing school,Renovation to accommodate 49 child care spaces,TORONTO,Central,105 THISTLE DOWN BLVD,M9V 1J5,,"$771,381 ",,Yes,,,,43.73836,-79.55391,
Child care,Education,TORONTO,St. Thomas Aquinas Catholic Elementary School,Planning,23-Dec,Expansion of existing school,Addition to accommodate 88 child care spaces,TORONTO,Central,636 GLENHOLME AVE,M6E 3G9,,"$2,571,267 ",,Yes,,,,43.69591,-79.44507,
Child care,Education,TORONTO,Birch Cliff Public Elementary School,Under construction,24-Jan,Expansion of existing school,Addition to accommodate 49 child care spaces,TORONTO,Central,1650 KINGSTON RD,M1N 1S2,,"$3,583,904 ",,Yes,,Yes,,43.69198,-79.26556,
Child care,Education,TORONTO,Dixon Grove Public Elementary School,Under construction,24-Jan,Expansion of existing school,Addition to accommodate 88 child care spaces,TORONTO,Central,315 THE WESTWAY,M9R 1H1,,"$4,518,639 ",,Yes,,Yes,,43.6849,-79.55613,
Child care,Education,TORONTO,Elmbank Public Elementary School,Planning,24-Jan,Renovation of existing school,Renovation to accommodate 88 child care spaces,TORONTO,Central,10 PITTSBORO DR,M9V 3R4,,"$1,285,635 ",,Yes,,,,43.7359614,-79.5900105,
Child care,Education,TORONTO,Kingsview Village Junior Public Elementary School,Under construction,24-Jan,Expansion of existing school,Addition to accommodate 88 child care spaces,TORONTO,Central,1 YORK RD,M9R 3C8,,"$5,065,910 ",,Yes,,Yes,,43.6978014,-79.5505757,
Child care,Education,TORONTO,Valleyfield Junior Public Elementary School,Planning,24-Jan,Expansion of existing school,Addition to accommodate 88 child care spaces,TORONTO,Central,35 SASKATOON DR,M9P 2E8,,"$2,571,270 ",,Yes,,,,43.6938145,-79.5381092,
Child care,Education,TORONTO,Weston Memorial Junior Public Elementary School,Planning,24-Jan,Expansion of existing school,Addition to accommodate 49 child care spaces,TORONTO,Central,200 JOHN ST,M9N 1K2,,"$1,542,762 ",,Yes,,,,43.7061469,-79.5090791,
Child care,Education,TORONTO,Alexander Stirling Public Elementary School,Under construction,24-Jan,Expansion of existing school,Addition to accommodate 88 child care spaces,TORONTO,Central,70 FAWCETT TRAIL,M1B 3A9,,"$5,267,063 ",,Yes,,Yes,,43.81165,-79.20759,
Child care,Education,TORONTO,Dorset Park Public Elementary School,Under construction,24-Jan,Expansion of existing school,Addition to accommodate 49 child care spaces,TORONTO,Central,28 BLAISDALE RD,M1P 1V6,,"$2,936,947 ",,Yes,,Yes,,43.7501823,-79.278738,
Child care,Education,TORONTO,Ellesmere-Statton Public Elementary School,Under construction,24-Jan,Expansion of existing school,Addition to accommodate 88 child care spaces,TORONTO,Central,739 ELLESMERE RD,M1P 2W1,,"$3,952,825 ",,Yes,,Yes,,43.7632244,-79.2872459,
Child care,Education,TORONTO,Glen Ravine Junior Public Elementary School,Under construction,24-Jan,Expansion of existing school,Addition to accommodate 49 child care spaces,TORONTO,Central,11 GADSBY DR,M1K 4V4,,"$3,535,911 ",,Yes,,Yes,,43.7379607,-79.254351,
Child care,Education,TORONTO,Grey Owl Junior Public Elementary School,Under construction,24-Jan,Expansion of existing school,Addition to accommodate 88 child care spaces,TORONTO,Central,150 WICKSON TRAIL,M1B 1M4,,"$4,456,270 ",,Yes,,Yes,,43.80398,-79.21329,
Child care,Education,TORONTO,Emily Carr Public Elementary School,Under construction,24-Jan,Expansion of existing school,Addition to accommodate 88 child care spaces,TORONTO,Central,90 JOHN TABOR TRAIL,M1B 2V2,,"$5,298,528 ",,Yes,,Yes,,43.80501,-79.20692,
Child care,Education,TORONTO,General Crerar Public Elementary School,Planning,24-Apr,Expansion of existing school,Addition to accommodate 88 child care spaces,TORONTO,Central,30 MCGREGOR RD,M1P 1C8,,"$2,571,270 ",,Yes,,,,43.7458333,-79.2799718,
Child care,Education,TORONTO,Willow Park Junior Public Elementary School,Planning,24-Apr,Expansion of existing school,Addition to accommodate 88 child care spaces,TORONTO,Central,45 WINDOVER DR,M1G 1P1,,"$2,314,143 ",,Yes,,,,43.7611216,-79.2092731,
Child care,Education,TORONTO,Ionview Public Elementary School,Under construction,24-Jan,Expansion of existing school,Addition to accommodate 88 child care spaces,TORONTO,Central,90 IONVIEW RD,M1K 2Z9,,"$3,798,309 ",,Yes,,Yes,,43.7377846,-79.2747617,
Child care,Education,TORONTO,J G Workman Public Elementary School,Under construction,24-Jan,Expansion of existing school,Addition to accommodate 88 child care spaces,TORONTO,Central,487 BIRCHMOUNT RD,M1K 1N7,,"$3,667,953 ",,Yes,,Yes,,43.7075099,-79.2665415,
Child care,Education,TORONTO,Lord Roberts Junior Public Elementary School,Under construction,24-Jan,Expansion of existing school,Addition to accommodate 49 child care spaces,TORONTO,Central,165 LORD ROBERTS DR,M1K 3W5,,"$3,062,246 ",,Yes,,Yes,,43.7416752,-79.2638243,
Child care,Education,TORONTO,Malvern Junior Public Elementary School,Under construction,24-Jan,Expansion of existing school,Addition to accommodate 88 child care spaces,TORONTO,Central,70 MAMMOTH HALL TRAIL,M1B 1P6,,"$4,324,790 ",,Yes,,Yes,,43.79783,-79.23324,
Child care,Education,TORONTO,Military Trail Public Elementary School,Planning,24-Apr,Expansion of existing school,Addition to accommodate 88 child care spaces,TORONTO,Central,701 MILITARY TRAIL,M1E 4P6,,"$2,571,270 ",,Yes,,,,43.78911,-79.1971,
Child care,Education,TORONTO,Daystrom Public Elementary School,Planning,24-Jan,Expansion of existing school,Addition to accommodate 88 child care spaces,TORONTO,Central,25 DAYSTROM DR,M9M 2A8,,"$2,571,270 ",,Yes,,,,43.7478207,-79.5471978,
Child care,Education,TORONTO,Blessed Pope Paul VI Catholic Elementary School,Planning,2022,Renovation of existing school,Renovation to accommodate 39 child care spaces,TORONTO,Central,270 LAUGHTON AVE,M6N 2X8,,"$529,380 ",,Yes,,,,43.67432,-79.45752,
Child care,Education,TORONTO,St. Barbara Catholic Elementary School,Planning,23-Sep,Expansion of existing school,Addition to accommodate 49 child care spaces,TORONTO,Central,25 JANRAY DR,M1G 1Y2,,"$1,542,762 ",,Yes,,,,43.76244,-79.21884,
